{
  "spec_version": "0.1.0",
  "id": "urn:uuid:00000000-0000-4000-8000-00000000a700",
  "scope": {
    "completeness": "unknown"
  },
  "entities": [
    {
      "id": "urn:uuid:00000000-0000-4000-8000-00000000a701",
      "kind": "concept"
    },
    {
      "id": "urn:uuid:00000000-0000-4000-8000-00000000a702",
      "kind": "concept"
    }
  ]
}
