{
  "spec_version": "0.1.0",
  "id": "urn:uuid:00000000-0000-4000-8000-0000000001ae",
  "scope": {
    "completeness": "partial"
  },
  "namespaces": {
    "ex": "https://example.invalid/terms/"
  },
  "entities": [
    {
      "id": "urn:uuid:00000000-0000-4000-8000-0000000001af",
      "kind": "concept",
      "validity": {
        "kind": "ex:time",
        "from": {
          "kind": "date",
          "value": "2026-01-01"
        }
      }
    },
    {
      "id": "urn:uuid:00000000-0000-4000-8000-0000000001b0",
      "kind": "concept",
      "validity": {
        "kind": "ex:time",
        "until": {
          "kind": "date",
          "value": "2026-12-31"
        }
      }
    }
  ]
}
