{
  "spec_version": "0.1.0",
  "id": "urn:uuid:00000000-0000-4000-8000-000000000212",
  "scope": {
    "completeness": "partial"
  },
  "entities": [
    {
      "id": "urn:uuid:00000000-0000-4000-8000-000000000214",
      "kind": "concept"
    },
    {
      "id": "urn:uuid:00000000-0000-4000-8000-000000000213",
      "kind": "concept"
    }
  ]
}
