{
  "spec_version": "0.1.0",
  "id": "urn:uuid:00000000-0000-4000-8000-00000000019a",
  "scope": {
    "completeness": "partial"
  },
  "revision": {
    "id": "urn:uuid:00000000-0000-4000-8000-00000000019b",
    "parents": [
      {
        "target": "urn:uuid:00000000-0000-4000-8000-00000000019c",
        "location": "out-of-document"
      },
      {
        "target": "urn:uuid:00000000-0000-4000-8000-00000000019d",
        "location": "out-of-document"
      }
    ]
  }
}
